user_id,mix_id,mix_name,mix.tags,track_id,track_name,artist_name
1126,433,ethanlake05's August 2008 mix,,4367,Mr. Carter (Featuring Jay-Z) (,LIl Wayne
1126,433,ethanlake05's August 2008 mix,,4369,American Boy (Remix) (Feat Est,Kanye West
1126,433,ethanlake05's August 2008 mix,,4370,Put On (Feat Young Jeezy),Kanye West
1126,433,ethanlake05's August 2008 mix,,4371,I Luv Your Girl,The-Dream
1126,433,ethanlake05's August 2008 mix,,4372,The Pretender,Foo Fighters
1126,433,ethanlake05's August 2008 mix,,4373,Hip-Hop Saved My Life (featuring Nikki Jean),Lupe Fiasco
1126,433,ethanlake05's August 2008 mix,,4374,Hip-Hop Saved My Life (featuring Nikki Jean),Lupe Fiasco
